{
  "schemaVersion": "scaleproof.scenario/v1",
  "name": "sample-smoke",
  "target": {
    "profile": "sample-api"
  },
  "workload": {
    "engine": "k6",
    "profile": "smoke",
    "iterations": 2,
    "windows": {
      "measurement": "5s"
    }
  },
  "requests": [
    {
      "name": "sample-read",
      "method": "GET",
      "path": "/items"
    }
  ],
  "classification": {
    "environment": "local"
  }
}
