{
  "schemaVersion": "scaleproof.scenario/v1",
  "name": "explicit-empty",
  "target": {
    "profile": "sample-api"
  },
  "workload": {
    "engine": "k6",
    "profile": "smoke",
    "iterations": 2,
    "windows": {
      "measurement": "5s"
    },
    "timeouts": {},
    "limits": {}
  },
  "requests": [
    {
      "name": "sample-read",
      "method": "GET",
      "path": "/items",
      "params": {},
      "headers": {},
      "assertions": []
    }
  ],
  "classification": {
    "environment": "local",
    "mutation": false
  },
  "thresholds": [],
  "abort": [],
  "checks": [],
  "capture": {},
  "report": {
    "formats": []
  }
}
